[
  {
    "name": "git-stars",
    "description": "A curated list of GitHub stars ☕️",
    "author": "KBLLR",
    "stars": 0,
    "url": "https://github.com/KBLLR/git-stars",
    "date": "12/24/2023",
    "languages": [
      {
        "language": "HTML",
        "percentage": "100%"
      }
    ],
    "topics": [
      "github-stars",
      "programming",
      "system-design"
    ],
    "primary_language": "HTML",
    "license": "None",
    "forks": 0,
    "open_issues": 0,
    "last_updated": "2/4/2026",
    "last_updated_at": "2026-02-04T00:27:32Z",
    "created_at": "2023-12-23T23:09:43Z",
    "private": false,
    "has_readme": true,
    "is_owner": true,
    "is_fork": false
  },
  {
    "name": "code-platformer-ai",
    "description": "No description",
    "author": "KBLLR",
    "stars": 0,
    "url": "https://github.com/KBLLR/code-platformer-ai",
    "date": "10/11/2025",
    "languages": [
      {
        "language": "JavaScript",
        "percentage": "100%"
      }
    ],
    "topics": [],
    "primary_language": "JavaScript",
    "license": "None",
    "forks": 0,
    "open_issues": 0,
    "last_updated": "2/2/2026",
    "last_updated_at": "2026-02-02T09:23:52Z",
    "created_at": "2025-10-11T21:30:56Z",
    "private": false,
    "has_readme": true,
    "is_owner": true,
    "is_fork": false
  },
  {
    "name": "htdi-agentic-lab",
    "description": "No description",
    "author": "KBLLR",
    "stars": 0,
    "url": "https://github.com/KBLLR/htdi-agentic-lab",
    "date": "11/17/2025",
    "languages": [
      {
        "language": "JavaScript",
        "percentage": "100%"
      }
    ],
    "topics": [],
    "primary_language": "JavaScript",
    "license": "None",
    "forks": 0,
    "open_issues": 0,
    "last_updated": "12/1/2025",
    "last_updated_at": "2025-12-01T08:08:49Z",
    "created_at": "2025-11-17T04:01:43Z",
    "private": true,
    "has_readme": false,
    "is_owner": true,
    "is_fork": false
  },
  {
    "name": "gen-idea-lab",
    "description": "Connect with expert AI assistants for each subject and generate creative project ideas. A growing collection of micro-apps designed for agents with Human in the loop.",
    "author": "KBLLR",
    "stars": 0,
    "url": "https://github.com/KBLLR/gen-idea-lab",
    "date": "9/27/2025",
    "languages": [
      {
        "language": "JavaScript",
        "percentage": "100%"
      }
    ],
    "topics": [
      "documentation-generator",
      "multiagent-systems",
      "project-generator"
    ],
    "primary_language": "JavaScript",
    "license": "None",
    "forks": 0,
    "open_issues": 0,
    "last_updated": "1/6/2026",
    "last_updated_at": "2026-01-06T02:58:58Z",
    "created_at": "2025-09-27T20:04:09Z",
    "private": false,
    "has_readme": true,
    "is_owner": true,
    "is_fork": false
  },
  {
    "name": "le-belle-epoch",
    "description": "No description",
    "author": "KBLLR",
    "stars": 0,
    "url": "https://github.com/KBLLR/le-belle-epoch",
    "date": "12/28/2025",
    "languages": [
      {
        "language": "HTML",
        "percentage": "100%"
      }
    ],
    "topics": [],
    "primary_language": "HTML",
    "license": "None",
    "forks": 0,
    "open_issues": 0,
    "last_updated": "12/29/2025",
    "last_updated_at": "2025-12-28T23:22:47Z",
    "created_at": "2025-12-28T21:39:24Z",
    "private": false,
    "has_readme": false,
    "is_owner": true,
    "is_fork": false
  },
  {
    "name": "Avatars-Lab",
    "description": "No description",
    "author": "KBLLR",
    "stars": 0,
    "url": "https://github.com/KBLLR/Avatars-Lab",
    "date": "12/24/2025",
    "languages": [
      {
        "language": "TypeScript",
        "percentage": "100%"
      }
    ],
    "topics": [],
    "primary_language": "TypeScript",
    "license": "None",
    "forks": 0,
    "open_issues": 0,
    "last_updated": "12/28/2025",
    "last_updated_at": "2025-12-28T19:43:56Z",
    "created_at": "2025-12-24T02:03:52Z",
    "private": false,
    "has_readme": true,
    "is_owner": true,
    "is_fork": false
  },
  {
    "name": "code-smart-campus",
    "description": " Real-time 3D visualization of smart spaces, integrating live IoT data from Home Assistant for interactive monitoring of building floorplans and connected devices. ",
    "author": "KBLLR",
    "stars": 0,
    "url": "https://github.com/KBLLR/code-smart-campus",
    "date": "11/1/2025",
    "languages": [
      {
        "language": "JavaScript",
        "percentage": "100%"
      }
    ],
    "topics": [],
    "primary_language": "JavaScript",
    "license": "MIT",
    "forks": 0,
    "open_issues": 0,
    "last_updated": "12/15/2025",
    "last_updated_at": "2025-12-15T00:08:19Z",
    "created_at": "2025-11-01T14:37:32Z",
    "private": false,
    "has_readme": true,
    "is_owner": true,
    "is_fork": false
  },
  {
    "name": "secretsbank",
    "description": "No description",
    "author": "KBLLR",
    "stars": 0,
    "url": "https://github.com/KBLLR/secretsbank",
    "date": "11/18/2025",
    "languages": [
      {
        "language": "Python",
        "percentage": "100%"
      }
    ],
    "topics": [],
    "primary_language": "Python",
    "license": "None",
    "forks": 0,
    "open_issues": 0,
    "last_updated": "12/1/2025",
    "last_updated_at": "2025-12-01T08:12:07Z",
    "created_at": "2025-11-18T20:13:02Z",
    "private": true,
    "has_readme": true,
    "is_owner": true,
    "is_fork": false
  },
  {
    "name": "memoryblocks",
    "description": "No description",
    "author": "KBLLR",
    "stars": 0,
    "url": "https://github.com/KBLLR/memoryblocks",
    "date": "11/20/2025",
    "languages": [
      {
        "language": "TypeScript",
        "percentage": "100%"
      }
    ],
    "topics": [],
    "primary_language": "TypeScript",
    "license": "None",
    "forks": 0,
    "open_issues": 0,
    "last_updated": "11/23/2025",
    "last_updated_at": "2025-11-23T09:46:11Z",
    "created_at": "2025-11-20T18:14:32Z",
    "private": false,
    "has_readme": true,
    "is_owner": true,
    "is_fork": false
  },
  {
    "name": "mlx-rag-lab",
    "description": "No description",
    "author": "KBLLR",
    "stars": 0,
    "url": "https://github.com/KBLLR/mlx-rag-lab",
    "date": "11/5/2025",
    "languages": [
      {
        "language": "Python",
        "percentage": "100%"
      }
    ],
    "topics": [],
    "primary_language": "Python",
    "license": "MIT",
    "forks": 0,
    "open_issues": 0,
    "last_updated": "12/4/2025",
    "last_updated_at": "2025-12-03T23:28:00Z",
    "created_at": "2025-11-05T21:41:41Z",
    "private": false,
    "has_readme": true,
    "is_owner": true,
    "is_fork": false
  },
  {
    "name": "mlx-openai-server-lab",
    "description": "A high-performance API server that provides OpenAI-compatible endpoints for MLX models. Developed using Python and powered by the FastAPI framework, it provides an efficient, scalable, and user-friendly solution for running MLX-based vision and language models locally with an OpenAI-compatible interface.",
    "author": "KBLLR",
    "stars": 0,
    "url": "https://github.com/KBLLR/mlx-openai-server-lab",
    "date": "11/16/2025",
    "languages": [
      {
        "language": "Python",
        "percentage": "100%"
      }
    ],
    "topics": [],
    "primary_language": "Python",
    "license": "None",
    "forks": 0,
    "open_issues": 0,
    "last_updated": "11/20/2025",
    "last_updated_at": "2025-11-20T15:37:28Z",
    "created_at": "2025-11-15T23:58:58Z",
    "private": false,
    "has_readme": true,
    "is_owner": true,
    "is_fork": true
  },
  {
    "name": "htdi-project",
    "description": "Hard To Debug Issues",
    "author": "KBLLR",
    "stars": 0,
    "url": "https://github.com/KBLLR/htdi-project",
    "date": "1/16/2022",
    "languages": [
      {
        "language": "JavaScript",
        "percentage": "100%"
      }
    ],
    "topics": [],
    "primary_language": "JavaScript",
    "license": "None",
    "forks": 0,
    "open_issues": 0,
    "last_updated": "11/19/2025",
    "last_updated_at": "2025-11-19T15:46:18Z",
    "created_at": "2022-01-16T13:46:41Z",
    "private": false,
    "has_readme": true,
    "is_owner": true,
    "is_fork": false
  },
  {
    "name": "Leagentdiary",
    "description": "LeAgentDiary is a version-control system for AI agents. It connects handoffs, memory, and self-reflection into one timeline—track contributions, re-summon past agents, and evolve their personas. Built with the HTDI Agentic Framework for human-AI co-development.",
    "author": "KBLLR",
    "stars": 0,
    "url": "https://github.com/KBLLR/Leagentdiary",
    "date": "11/11/2025",
    "languages": [
      {
        "language": "TypeScript",
        "percentage": "100%"
      }
    ],
    "topics": [],
    "primary_language": "TypeScript",
    "license": "MIT",
    "forks": 0,
    "open_issues": 0,
    "last_updated": "11/18/2025",
    "last_updated_at": "2025-11-18T21:54:17Z",
    "created_at": "2025-11-11T17:31:52Z",
    "private": false,
    "has_readme": true,
    "is_owner": true,
    "is_fork": false
  },
  {
    "name": "modal-apps-lab",
    "description": "No description",
    "author": "KBLLR",
    "stars": 0,
    "url": "https://github.com/KBLLR/modal-apps-lab",
    "date": "11/17/2025",
    "languages": [
      {
        "language": "Python",
        "percentage": "100%"
      }
    ],
    "topics": [],
    "primary_language": "Python",
    "license": "None",
    "forks": 0,
    "open_issues": 0,
    "last_updated": "11/17/2025",
    "last_updated_at": "2025-11-17T13:01:13Z",
    "created_at": "2025-11-17T13:01:04Z",
    "private": true,
    "has_readme": true,
    "is_owner": true,
    "is_fork": false
  },
  {
    "name": "htdi-agentic-framework",
    "description": "No description",
    "author": "KBLLR",
    "stars": 0,
    "url": "https://github.com/KBLLR/htdi-agentic-framework",
    "date": "11/17/2025",
    "languages": [
      {
        "language": "JavaScript",
        "percentage": "100%"
      }
    ],
    "topics": [],
    "primary_language": "JavaScript",
    "license": "None",
    "forks": 0,
    "open_issues": 0,
    "last_updated": "11/17/2025",
    "last_updated_at": "2025-11-17T08:38:26Z",
    "created_at": "2025-11-17T04:01:15Z",
    "private": true,
    "has_readme": false,
    "is_owner": true,
    "is_fork": false
  },
  {
    "name": "project_anja",
    "description": "No description",
    "author": "KBLLR",
    "stars": 0,
    "url": "https://github.com/KBLLR/project_anja",
    "date": "8/20/2025",
    "languages": [
      {
        "language": "JavaScript",
        "percentage": "100%"
      }
    ],
    "topics": [],
    "primary_language": "JavaScript",
    "license": "None",
    "forks": 0,
    "open_issues": 0,
    "last_updated": "11/17/2025",
    "last_updated_at": "2025-11-17T04:02:56Z",
    "created_at": "2025-08-20T18:15:48Z",
    "private": true,
    "has_readme": true,
    "is_owner": true,
    "is_fork": false
  },
  {
    "name": "flirtcopilot",
    "description": "No description",
    "author": "KBLLR",
    "stars": 0,
    "url": "https://github.com/KBLLR/flirtcopilot",
    "date": "11/15/2025",
    "languages": [
      {
        "language": "JavaScript",
        "percentage": "100%"
      }
    ],
    "topics": [],
    "primary_language": "JavaScript",
    "license": "None",
    "forks": 0,
    "open_issues": 0,
    "last_updated": "11/17/2025",
    "last_updated_at": "2025-11-17T01:52:43Z",
    "created_at": "2025-11-15T21:16:00Z",
    "private": true,
    "has_readme": true,
    "is_owner": true,
    "is_fork": false
  },
  {
    "name": "3dmodel-splats-stager",
    "description": "A modern, high-performance 3D object stager specializing in Gaussian Splatting models, built with Three.js and Vite. This application enables advanced visualization of 3D models with sophisticated post-processing effects and real-time parameter adjustment.",
    "author": "KBLLR",
    "stars": 1,
    "url": "https://github.com/KBLLR/3dmodel-splats-stager",
    "date": "11/6/2024",
    "languages": [
      {
        "language": "JavaScript",
        "percentage": "100%"
      }
    ],
    "topics": [],
    "primary_language": "JavaScript",
    "license": "MIT",
    "forks": 0,
    "open_issues": 0,
    "last_updated": "11/17/2025",
    "last_updated_at": "2025-11-17T01:49:33Z",
    "created_at": "2024-11-06T13:13:25Z",
    "private": false,
    "has_readme": true,
    "is_owner": true,
    "is_fork": false
  },
  {
    "name": "ada-agents",
    "description": "No description",
    "author": "KBLLR",
    "stars": 0,
    "url": "https://github.com/KBLLR/ada-agents",
    "date": "9/27/2025",
    "languages": [
      {
        "language": "Python",
        "percentage": "100%"
      }
    ],
    "topics": [],
    "primary_language": "Python",
    "license": "None",
    "forks": 0,
    "open_issues": 0,
    "last_updated": "11/17/2025",
    "last_updated_at": "2025-11-17T01:14:37Z",
    "created_at": "2025-09-27T19:42:04Z",
    "private": true,
    "has_readme": true,
    "is_owner": true,
    "is_fork": false
  },
  {
    "name": "gen_avatar_debate",
    "description": "No description",
    "author": "KBLLR",
    "stars": 0,
    "url": "https://github.com/KBLLR/gen_avatar_debate",
    "date": "9/27/2025",
    "languages": [
      {
        "language": "JavaScript",
        "percentage": "100%"
      }
    ],
    "topics": [],
    "primary_language": "JavaScript",
    "license": "None",
    "forks": 0,
    "open_issues": 0,
    "last_updated": "11/16/2025",
    "last_updated_at": "2025-11-16T20:58:46Z",
    "created_at": "2025-09-27T15:48:44Z",
    "private": true,
    "has_readme": true,
    "is_owner": true,
    "is_fork": false
  },
  {
    "name": "moonsyc",
    "description": "Moonsyc is a social network for AI-native creators, where humans and their AI agents share, distribute, and collaborate on creative work.",
    "author": "KBLLR",
    "stars": 0,
    "url": "https://github.com/KBLLR/moonsyc",
    "date": "8/7/2024",
    "languages": [
      {
        "language": "JavaScript",
        "percentage": "100%"
      }
    ],
    "topics": [],
    "primary_language": "JavaScript",
    "license": "None",
    "forks": 0,
    "open_issues": 0,
    "last_updated": "11/15/2025",
    "last_updated_at": "2025-11-15T21:21:45Z",
    "created_at": "2024-08-07T18:46:02Z",
    "private": true,
    "has_readme": true,
    "is_owner": true,
    "is_fork": false
  },
  {
    "name": "city-blocks",
    "description": "No description",
    "author": "KBLLR",
    "stars": 0,
    "url": "https://github.com/KBLLR/city-blocks",
    "date": "11/10/2025",
    "languages": [
      {
        "language": "JavaScript",
        "percentage": "100%"
      }
    ],
    "topics": [],
    "primary_language": "JavaScript",
    "license": "None",
    "forks": 0,
    "open_issues": 0,
    "last_updated": "11/10/2025",
    "last_updated_at": "2025-11-10T04:51:23Z",
    "created_at": "2025-11-10T02:41:29Z",
    "private": false,
    "has_readme": true,
    "is_owner": true,
    "is_fork": false
  },
  {
    "name": "KBLLR-template-ThreeJS",
    "description": "No description",
    "author": "KBLLR",
    "stars": 0,
    "url": "https://github.com/KBLLR/KBLLR-template-ThreeJS",
    "date": "10/17/2023",
    "languages": [
      {
        "language": "JavaScript",
        "percentage": "100%"
      }
    ],
    "topics": [],
    "primary_language": "JavaScript",
    "license": "None",
    "forks": 0,
    "open_issues": 1,
    "last_updated": "10/18/2025",
    "last_updated_at": "2025-10-18T14:19:46Z",
    "created_at": "2023-10-17T12:39:57Z",
    "private": true,
    "has_readme": true,
    "is_owner": true,
    "is_fork": false
  },
  {
    "name": "panorama-to-cubemap",
    "description": "Convert an equirectangular panorama to six cube faces",
    "author": "KBLLR",
    "stars": 0,
    "url": "https://github.com/KBLLR/panorama-to-cubemap",
    "date": "9/13/2023",
    "languages": [
      {
        "language": "JavaScript",
        "percentage": "100%"
      }
    ],
    "topics": [],
    "primary_language": "JavaScript",
    "license": "LGPL-3.0",
    "forks": 0,
    "open_issues": 0,
    "last_updated": "10/18/2025",
    "last_updated_at": "2025-10-18T04:17:29Z",
    "created_at": "2023-09-13T03:50:19Z",
    "private": false,
    "has_readme": true,
    "is_owner": true,
    "is_fork": true
  },
  {
    "name": "icon-generator",
    "description": "No description",
    "author": "KBLLR",
    "stars": 0,
    "url": "https://github.com/KBLLR/icon-generator",
    "date": "10/12/2023",
    "languages": [
      {
        "language": "JavaScript",
        "percentage": "100%"
      }
    ],
    "topics": [],
    "primary_language": "JavaScript",
    "license": "None",
    "forks": 0,
    "open_issues": 0,
    "last_updated": "10/16/2025",
    "last_updated_at": "2025-10-15T22:16:19Z",
    "created_at": "2023-10-12T12:05:19Z",
    "private": true,
    "has_readme": true,
    "is_owner": true,
    "is_fork": false
  },
  {
    "name": "kbllr-graphics-threejs",
    "description": "An evolving portfolio of small-scale projects showcasing my journey in learning and experimenting with diverse web technologies. (WIP)",
    "author": "KBLLR",
    "stars": 0,
    "url": "https://github.com/KBLLR/kbllr-graphics-threejs",
    "date": "6/18/2022",
    "languages": [
      {
        "language": "JavaScript",
        "percentage": "100%"
      }
    ],
    "topics": [
      "3d-graphics",
      "animation",
      "creative-coding",
      "javascript",
      "threejs",
      "vite",
      "webgl"
    ],
    "primary_language": "JavaScript",
    "license": "None",
    "forks": 0,
    "open_issues": 0,
    "last_updated": "10/15/2025",
    "last_updated_at": "2025-10-15T21:10:40Z",
    "created_at": "2022-06-18T18:40:00Z",
    "private": false,
    "has_readme": true,
    "is_owner": true,
    "is_fork": false
  },
  {
    "name": "the-meta-chronicle",
    "description": "No description",
    "author": "KBLLR",
    "stars": 0,
    "url": "https://github.com/KBLLR/the-meta-chronicle",
    "date": "1/23/2025",
    "languages": [
      {
        "language": "TypeScript",
        "percentage": "100%"
      }
    ],
    "topics": [],
    "primary_language": "TypeScript",
    "license": "MIT",
    "forks": 0,
    "open_issues": 2,
    "last_updated": "1/22/2026",
    "last_updated_at": "2026-01-22T04:54:02Z",
    "created_at": "2025-01-23T19:54:18Z",
    "private": true,
    "has_readme": true,
    "is_owner": true,
    "is_fork": false
  },
  {
    "name": "Threejs-nerf-visualizer",
    "description": "A web-based 3D viewer for Gaussian Splatting models using Three.js and Luma.gl. Features environment mapping, post-processing effects, and interactive controls.",
    "author": "KBLLR",
    "stars": 1,
    "url": "https://github.com/KBLLR/Threejs-nerf-visualizer",
    "date": "11/3/2024",
    "languages": [
      {
        "language": "JavaScript",
        "percentage": "100%"
      }
    ],
    "topics": [],
    "primary_language": "JavaScript",
    "license": "MIT",
    "forks": 0,
    "open_issues": 0,
    "last_updated": "10/13/2025",
    "last_updated_at": "2025-10-13T17:02:04Z",
    "created_at": "2024-11-03T09:54:49Z",
    "private": true,
    "has_readme": true,
    "is_owner": true,
    "is_fork": false
  },
  {
    "name": "KBLLR_generative_AI23",
    "description": "No description",
    "author": "KBLLR",
    "stars": 0,
    "url": "https://github.com/KBLLR/KBLLR_generative_AI23",
    "date": "10/14/2023",
    "languages": [
      {
        "language": "JavaScript",
        "percentage": "100%"
      }
    ],
    "topics": [],
    "primary_language": "JavaScript",
    "license": "None",
    "forks": 0,
    "open_issues": 1,
    "last_updated": "2/3/2026",
    "last_updated_at": "2026-02-03T18:04:03Z",
    "created_at": "2023-10-14T20:54:49Z",
    "private": true,
    "has_readme": true,
    "is_owner": true,
    "is_fork": false
  },
  {
    "name": "LANDING_PAGE-001",
    "description": "No description",
    "author": "KBLLR",
    "stars": 0,
    "url": "https://github.com/KBLLR/LANDING_PAGE-001",
    "date": "4/7/2023",
    "languages": [
      {
        "language": "TypeScript",
        "percentage": "100%"
      }
    ],
    "topics": [],
    "primary_language": "TypeScript",
    "license": "MIT",
    "forks": 0,
    "open_issues": 0,
    "last_updated": "10/11/2025",
    "last_updated_at": "2025-10-11T10:16:37Z",
    "created_at": "2023-04-07T06:46:12Z",
    "private": false,
    "has_readme": true,
    "is_owner": true,
    "is_fork": false
  },
  {
    "name": "HCI_modules_test001",
    "description": "No description",
    "author": "KBLLR",
    "stars": 0,
    "url": "https://github.com/KBLLR/HCI_modules_test001",
    "date": "4/7/2023",
    "languages": [
      {
        "language": "JavaScript",
        "percentage": "100%"
      }
    ],
    "topics": [],
    "primary_language": "JavaScript",
    "license": "None",
    "forks": 0,
    "open_issues": 0,
    "last_updated": "10/10/2025",
    "last_updated_at": "2025-10-10T13:48:42Z",
    "created_at": "2023-04-07T18:55:57Z",
    "private": true,
    "has_readme": true,
    "is_owner": true,
    "is_fork": false
  },
  {
    "name": "3DKNIGHT.art",
    "description": "No description",
    "author": "KBLLR",
    "stars": 0,
    "url": "https://github.com/KBLLR/3DKNIGHT.art",
    "date": "3/21/2022",
    "languages": [
      {
        "language": "HTML",
        "percentage": "100%"
      }
    ],
    "topics": [],
    "primary_language": "HTML",
    "license": "MIT",
    "forks": 0,
    "open_issues": 0,
    "last_updated": "10/9/2025",
    "last_updated_at": "2025-10-09T17:21:52Z",
    "created_at": "2022-03-21T13:38:55Z",
    "private": false,
    "has_readme": true,
    "is_owner": true,
    "is_fork": false
  },
  {
    "name": "Documentation_learnings-MMXX-MMXXII",
    "description": "No description",
    "author": "KBLLR",
    "stars": 0,
    "url": "https://github.com/KBLLR/Documentation_learnings-MMXX-MMXXII",
    "date": "5/3/2022",
    "languages": [
      {
        "language": "JavaScript",
        "percentage": "100%"
      }
    ],
    "topics": [],
    "primary_language": "JavaScript",
    "license": "MIT",
    "forks": 0,
    "open_issues": 0,
    "last_updated": "10/9/2025",
    "last_updated_at": "2025-10-09T09:24:50Z",
    "created_at": "2022-05-03T10:23:50Z",
    "private": true,
    "has_readme": true,
    "is_owner": true,
    "is_fork": false
  },
  {
    "name": "livekit-project-idea-lab",
    "description": "No description",
    "author": "KBLLR",
    "stars": 0,
    "url": "https://github.com/KBLLR/livekit-project-idea-lab",
    "date": "10/5/2025",
    "languages": [
      {
        "language": "TypeScript",
        "percentage": "100%"
      }
    ],
    "topics": [],
    "primary_language": "TypeScript",
    "license": "MIT",
    "forks": 0,
    "open_issues": 0,
    "last_updated": "10/5/2025",
    "last_updated_at": "2025-10-05T15:39:24Z",
    "created_at": "2025-10-05T15:39:22Z",
    "private": true,
    "has_readme": true,
    "is_owner": true,
    "is_fork": false
  },
  {
    "name": "empathic-ai",
    "description": "No description",
    "author": "KBLLR",
    "stars": 0,
    "url": "https://github.com/KBLLR/empathic-ai",
    "date": "10/1/2025",
    "languages": [
      {
        "language": "TypeScript",
        "percentage": "100%"
      }
    ],
    "topics": [],
    "primary_language": "TypeScript",
    "license": "None",
    "forks": 0,
    "open_issues": 0,
    "last_updated": "10/1/2025",
    "last_updated_at": "2025-10-01T10:13:37Z",
    "created_at": "2025-10-01T10:13:28Z",
    "private": true,
    "has_readme": true,
    "is_owner": true,
    "is_fork": false
  },
  {
    "name": "webgi-scene",
    "description": "A modern, high-performance 3D object stager specializing in Gaussian Splatting models, built with WebGi. This application enables advanced visualization of 3D models with sophisticated post-processing effects and real-time parameter adjustment.",
    "author": "KBLLR",
    "stars": 0,
    "url": "https://github.com/KBLLR/webgi-scene",
    "date": "8/5/2025",
    "languages": [
      {
        "language": "TypeScript",
        "percentage": "100%"
      }
    ],
    "topics": [],
    "primary_language": "TypeScript",
    "license": "None",
    "forks": 0,
    "open_issues": 0,
    "last_updated": "9/24/2025",
    "last_updated_at": "2025-09-23T22:21:30Z",
    "created_at": "2025-08-05T10:29:01Z",
    "private": false,
    "has_readme": true,
    "is_owner": true,
    "is_fork": false
  },
  {
    "name": "MariCoin",
    "description": "Informative website about a crypto asset for the LGTBQI+ community",
    "author": "KBLLR",
    "stars": 0,
    "url": "https://github.com/KBLLR/MariCoin",
    "date": "12/18/2021",
    "languages": [
      {
        "language": "CSS",
        "percentage": "100%"
      }
    ],
    "topics": [],
    "primary_language": "CSS",
    "license": "None",
    "forks": 0,
    "open_issues": 0,
    "last_updated": "7/22/2025",
    "last_updated_at": "2025-07-22T19:38:16Z",
    "created_at": "2021-12-18T12:33:00Z",
    "private": true,
    "has_readme": true,
    "is_owner": true,
    "is_fork": false
  },
  {
    "name": "ChatDev",
    "description": "Create Customized Software using Natural Language Idea (through LLM-powered Multi-Agent Collaboration)",
    "author": "KBLLR",
    "stars": 0,
    "url": "https://github.com/KBLLR/ChatDev",
    "date": "9/27/2023",
    "languages": [
      {
        "language": "Python",
        "percentage": "100%"
      }
    ],
    "topics": [],
    "primary_language": "Python",
    "license": "Apache-2.0",
    "forks": 0,
    "open_issues": 0,
    "last_updated": "7/17/2025",
    "last_updated_at": "2025-07-17T15:33:54Z",
    "created_at": "2023-09-27T07:39:38Z",
    "private": false,
    "has_readme": true,
    "is_owner": true,
    "is_fork": true
  },
  {
    "name": "Auto-GPT",
    "description": "An experimental open-source attempt to make GPT-4 fully autonomous.",
    "author": "KBLLR",
    "stars": 0,
    "url": "https://github.com/KBLLR/Auto-GPT",
    "date": "9/22/2023",
    "languages": [
      {
        "language": "Python",
        "percentage": "100%"
      }
    ],
    "topics": [],
    "primary_language": "Python",
    "license": "NOASSERTION",
    "forks": 0,
    "open_issues": 1,
    "last_updated": "7/16/2025",
    "last_updated_at": "2025-07-16T20:29:43Z",
    "created_at": "2023-09-22T09:12:35Z",
    "private": false,
    "has_readme": true,
    "is_owner": true,
    "is_fork": true
  },
  {
    "name": "ai-comic-factory",
    "description": "Generate comic panels using a LLM + SDXL. Powered by Hugging Face 🤗",
    "author": "KBLLR",
    "stars": 0,
    "url": "https://github.com/KBLLR/ai-comic-factory",
    "date": "9/14/2023",
    "languages": [
      {
        "language": "TypeScript",
        "percentage": "100%"
      }
    ],
    "topics": [],
    "primary_language": "TypeScript",
    "license": "Apache-2.0",
    "forks": 0,
    "open_issues": 0,
    "last_updated": "7/16/2025",
    "last_updated_at": "2025-07-16T20:22:31Z",
    "created_at": "2023-09-14T11:49:38Z",
    "private": false,
    "has_readme": true,
    "is_owner": true,
    "is_fork": true
  },
  {
    "name": "talking-heads-papers",
    "description": "🎓Automatically Update TH Papers Bi Daily using Github Actions ",
    "author": "KBLLR",
    "stars": 1,
    "url": "https://github.com/KBLLR/talking-heads-papers",
    "date": "2/7/2025",
    "languages": [
      {
        "language": "Python",
        "percentage": "100%"
      }
    ],
    "topics": [],
    "primary_language": "Python",
    "license": "Apache-2.0",
    "forks": 0,
    "open_issues": 0,
    "last_updated": "7/13/2025",
    "last_updated_at": "2025-07-13T18:31:50Z",
    "created_at": "2025-02-07T10:03:03Z",
    "private": false,
    "has_readme": true,
    "is_owner": true,
    "is_fork": true
  },
  {
    "name": "v0-cyberpunk-dashboard-design",
    "description": "No description",
    "author": "KBLLR",
    "stars": 0,
    "url": "https://github.com/KBLLR/v0-cyberpunk-dashboard-design",
    "date": "7/3/2025",
    "languages": [
      {
        "language": "TypeScript",
        "percentage": "100%"
      }
    ],
    "topics": [],
    "primary_language": "TypeScript",
    "license": "None",
    "forks": 0,
    "open_issues": 0,
    "last_updated": "7/3/2025",
    "last_updated_at": "2025-07-03T11:49:38Z",
    "created_at": "2025-07-03T11:49:30Z",
    "private": true,
    "has_readme": true,
    "is_owner": true,
    "is_fork": false
  },
  {
    "name": "3D-model-viewer-configurator",
    "description": "Real-time 3D Furniture Customizer: Proof of Concept",
    "author": "KBLLR",
    "stars": 0,
    "url": "https://github.com/KBLLR/3D-model-viewer-configurator",
    "date": "3/6/2023",
    "languages": [
      {
        "language": "JavaScript",
        "percentage": "100%"
      }
    ],
    "topics": [
      "3d-configurator",
      "3d-models",
      "3d-viewer",
      "prototype",
      "threejs-learning"
    ],
    "primary_language": "JavaScript",
    "license": "None",
    "forks": 0,
    "open_issues": 0,
    "last_updated": "6/18/2025",
    "last_updated_at": "2025-06-18T03:37:27Z",
    "created_at": "2023-03-06T10:21:53Z",
    "private": false,
    "has_readme": true,
    "is_owner": true,
    "is_fork": false
  },
  {
    "name": "avatar-os",
    "description": "No description",
    "author": "KBLLR",
    "stars": 0,
    "url": "https://github.com/KBLLR/avatar-os",
    "date": "6/17/2025",
    "languages": [],
    "topics": [],
    "primary_language": "Unknown",
    "license": "None",
    "forks": 0,
    "open_issues": 0,
    "last_updated": "6/17/2025",
    "last_updated_at": "2025-06-17T21:10:26Z",
    "created_at": "2025-06-17T21:10:26Z",
    "private": false,
    "has_readme": false,
    "is_owner": true,
    "is_fork": false
  },
  {
    "name": "mindmesh",
    "description": "No description",
    "author": "KBLLR",
    "stars": 0,
    "url": "https://github.com/KBLLR/mindmesh",
    "date": "5/4/2025",
    "languages": [
      {
        "language": "Python",
        "percentage": "100%"
      }
    ],
    "topics": [],
    "primary_language": "Python",
    "license": "MIT",
    "forks": 0,
    "open_issues": 0,
    "last_updated": "5/4/2025",
    "last_updated_at": "2025-05-04T17:25:59Z",
    "created_at": "2025-05-04T17:24:57Z",
    "private": true,
    "has_readme": true,
    "is_owner": true,
    "is_fork": false
  },
  {
    "name": "Speech-Services-Azure",
    "description": "No description",
    "author": "KBLLR",
    "stars": 0,
    "url": "https://github.com/KBLLR/Speech-Services-Azure",
    "date": "4/3/2025",
    "languages": [
      {
        "language": "PowerShell",
        "percentage": "100%"
      }
    ],
    "topics": [],
    "primary_language": "PowerShell",
    "license": "MIT",
    "forks": 0,
    "open_issues": 0,
    "last_updated": "4/3/2025",
    "last_updated_at": "2025-04-03T00:46:35Z",
    "created_at": "2025-04-03T00:46:33Z",
    "private": false,
    "has_readme": true,
    "is_owner": true,
    "is_fork": false
  },
  {
    "name": "dam-test",
    "description": "db test ",
    "author": "KBLLR",
    "stars": 0,
    "url": "https://github.com/KBLLR/dam-test",
    "date": "2/12/2025",
    "languages": [],
    "topics": [],
    "primary_language": "Unknown",
    "license": "None",
    "forks": 0,
    "open_issues": 0,
    "last_updated": "2/12/2025",
    "last_updated_at": "2025-02-12T19:06:32Z",
    "created_at": "2025-02-12T19:06:32Z",
    "private": true,
    "has_readme": true,
    "is_owner": true,
    "is_fork": false
  },
  {
    "name": "simple-flask-api-restx",
    "description": "No description",
    "author": "KBLLR",
    "stars": 0,
    "url": "https://github.com/KBLLR/simple-flask-api-restx",
    "date": "2/4/2025",
    "languages": [
      {
        "language": "Python",
        "percentage": "100%"
      }
    ],
    "topics": [],
    "primary_language": "Python",
    "license": "MIT",
    "forks": 0,
    "open_issues": 0,
    "last_updated": "2/4/2025",
    "last_updated_at": "2025-02-04T12:41:49Z",
    "created_at": "2025-02-04T12:41:46Z",
    "private": false,
    "has_readme": true,
    "is_owner": true,
    "is_fork": false
  },
  {
    "name": "Blender-GPT",
    "description": "An all-in-one Blender assistant powered by GPT3/4 + Whisper integration",
    "author": "KBLLR",
    "stars": 0,
    "url": "https://github.com/KBLLR/Blender-GPT",
    "date": "1/28/2025",
    "languages": [],
    "topics": [],
    "primary_language": "Unknown",
    "license": "Apache-2.0",
    "forks": 0,
    "open_issues": 0,
    "last_updated": "9/9/2024",
    "last_updated_at": "2024-09-09T20:11:08Z",
    "created_at": "2025-01-28T17:10:28Z",
    "private": false,
    "has_readme": true,
    "is_owner": true,
    "is_fork": true
  },
  {
    "name": "validator",
    "description": "No description",
    "author": "KBLLR",
    "stars": 0,
    "url": "https://github.com/KBLLR/validator",
    "date": "1/25/2025",
    "languages": [
      {
        "language": "Python",
        "percentage": "100%"
      }
    ],
    "topics": [],
    "primary_language": "Python",
    "license": "Apache-2.0",
    "forks": 0,
    "open_issues": 0,
    "last_updated": "1/25/2025",
    "last_updated_at": "2025-01-25T14:05:49Z",
    "created_at": "2025-01-25T14:05:47Z",
    "private": false,
    "has_readme": true,
    "is_owner": true,
    "is_fork": false
  },
  {
    "name": "dja-nominations-tool",
    "description": "No description",
    "author": "KBLLR",
    "stars": 0,
    "url": "https://github.com/KBLLR/dja-nominations-tool",
    "date": "8/14/2024",
    "languages": [
      {
        "language": "JavaScript",
        "percentage": "100%"
      }
    ],
    "topics": [],
    "primary_language": "JavaScript",
    "license": "BSD-2-Clause",
    "forks": 0,
    "open_issues": 0,
    "last_updated": "8/14/2024",
    "last_updated_at": "2024-08-14T12:48:30Z",
    "created_at": "2024-08-14T11:41:49Z",
    "private": true,
    "has_readme": true,
    "is_owner": true,
    "is_fork": false
  },
  {
    "name": "dja_panel_dashboard",
    "description": "No description",
    "author": "KBLLR",
    "stars": 0,
    "url": "https://github.com/KBLLR/dja_panel_dashboard",
    "date": "7/31/2024",
    "languages": [
      {
        "language": "JavaScript",
        "percentage": "100%"
      }
    ],
    "topics": [],
    "primary_language": "JavaScript",
    "license": "BSD-2-Clause",
    "forks": 0,
    "open_issues": 1,
    "last_updated": "8/14/2024",
    "last_updated_at": "2024-08-14T11:21:38Z",
    "created_at": "2024-07-31T21:27:31Z",
    "private": true,
    "has_readme": true,
    "is_owner": true,
    "is_fork": false
  },
  {
    "name": "dja-db",
    "description": "No description",
    "author": "KBLLR",
    "stars": 0,
    "url": "https://github.com/KBLLR/dja-db",
    "date": "8/8/2024",
    "languages": [
      {
        "language": "TypeScript",
        "percentage": "100%"
      }
    ],
    "topics": [],
    "primary_language": "TypeScript",
    "license": "None",
    "forks": 0,
    "open_issues": 0,
    "last_updated": "8/8/2024",
    "last_updated_at": "2024-08-08T04:54:39Z",
    "created_at": "2024-08-08T04:54:35Z",
    "private": true,
    "has_readme": true,
    "is_owner": true,
    "is_fork": false
  },
  {
    "name": "DJA-candidates-dashboard",
    "description": "Web App built as an internal tool for the team of DJ Awards Ibiza",
    "author": "KBLLR",
    "stars": 0,
    "url": "https://github.com/KBLLR/DJA-candidates-dashboard",
    "date": "7/26/2024",
    "languages": [
      {
        "language": "JavaScript",
        "percentage": "100%"
      }
    ],
    "topics": [],
    "primary_language": "JavaScript",
    "license": "BSD-2-Clause",
    "forks": 0,
    "open_issues": 0,
    "last_updated": "7/28/2024",
    "last_updated_at": "2024-07-28T13:25:36Z",
    "created_at": "2024-07-26T19:45:49Z",
    "private": true,
    "has_readme": true,
    "is_owner": true,
    "is_fork": false
  },
  {
    "name": "gpt4o-voice-preview-main",
    "description": "No description",
    "author": "KBLLR",
    "stars": 0,
    "url": "https://github.com/KBLLR/gpt4o-voice-preview-main",
    "date": "5/22/2024",
    "languages": [
      {
        "language": "Python",
        "percentage": "100%"
      }
    ],
    "topics": [],
    "primary_language": "Python",
    "license": "None",
    "forks": 0,
    "open_issues": 0,
    "last_updated": "5/22/2024",
    "last_updated_at": "2024-05-22T16:06:10Z",
    "created_at": "2024-05-22T15:32:01Z",
    "private": false,
    "has_readme": true,
    "is_owner": true,
    "is_fork": false
  },
  {
    "name": "sdxl_lighting",
    "description": "No description",
    "author": "KBLLR",
    "stars": 0,
    "url": "https://github.com/KBLLR/sdxl_lighting",
    "date": "2/28/2024",
    "languages": [
      {
        "language": "JavaScript",
        "percentage": "100%"
      }
    ],
    "topics": [],
    "primary_language": "JavaScript",
    "license": "AGPL-3.0",
    "forks": 0,
    "open_issues": 0,
    "last_updated": "2/28/2024",
    "last_updated_at": "2024-02-27T23:48:19Z",
    "created_at": "2024-02-27T23:48:14Z",
    "private": true,
    "has_readme": true,
    "is_owner": true,
    "is_fork": false
  },
  {
    "name": "javascript-algorithms",
    "description": "📝 Algorithms and data structures implemented in JavaScript with explanations and links to further readings",
    "author": "KBLLR",
    "stars": 0,
    "url": "https://github.com/KBLLR/javascript-algorithms",
    "date": "3/10/2023",
    "languages": [],
    "topics": [],
    "primary_language": "Unknown",
    "license": "MIT",
    "forks": 0,
    "open_issues": 0,
    "last_updated": "2/4/2023",
    "last_updated_at": "2023-02-04T08:19:08Z",
    "created_at": "2023-03-10T22:31:13Z",
    "private": false,
    "has_readme": true,
    "is_owner": true,
    "is_fork": true
  },
  {
    "name": "StableCascade",
    "description": "Official Code for Stable Cascade",
    "author": "KBLLR",
    "stars": 0,
    "url": "https://github.com/KBLLR/StableCascade",
    "date": "2/21/2024",
    "languages": [],
    "topics": [],
    "primary_language": "Unknown",
    "license": "MIT",
    "forks": 0,
    "open_issues": 0,
    "last_updated": "2/21/2024",
    "last_updated_at": "2024-02-21T07:51:35Z",
    "created_at": "2024-02-21T18:55:28Z",
    "private": false,
    "has_readme": true,
    "is_owner": true,
    "is_fork": true
  },
  {
    "name": "Deep-Dive-Into-AI-With-MLX-PyTorch",
    "description": "\"Deep Dive into AI with MLX and PyTorch\" is an educational initiative designed to help anyone interested in AI, specifically in machine learning and deep learning, using Apple's MLX and Meta's PyTorch frameworks.",
    "author": "KBLLR",
    "stars": 0,
    "url": "https://github.com/KBLLR/Deep-Dive-Into-AI-With-MLX-PyTorch",
    "date": "2/20/2024",
    "languages": [
      {
        "language": "Python",
        "percentage": "100%"
      }
    ],
    "topics": [],
    "primary_language": "Python",
    "license": "MIT",
    "forks": 0,
    "open_issues": 0,
    "last_updated": "3/5/2024",
    "last_updated_at": "2024-03-05T17:27:49Z",
    "created_at": "2024-02-20T00:30:35Z",
    "private": false,
    "has_readme": true,
    "is_owner": true,
    "is_fork": true
  },
  {
    "name": "oblik_3d-visualiser",
    "description": "Berlin's emblematic designer furniture shop OBLIK's AR/VR 3d viewer app. Experience the luxury and style of OBLI's furniture in your home.",
    "author": "KBLLR",
    "stars": 0,
    "url": "https://github.com/KBLLR/oblik_3d-visualiser",
    "date": "2/12/2024",
    "languages": [
      {
        "language": "TypeScript",
        "percentage": "100%"
      }
    ],
    "topics": [],
    "primary_language": "TypeScript",
    "license": "None",
    "forks": 0,
    "open_issues": 0,
    "last_updated": "2/12/2024",
    "last_updated_at": "2024-02-12T19:02:26Z",
    "created_at": "2024-02-12T19:02:24Z",
    "private": false,
    "has_readme": true,
    "is_owner": true,
    "is_fork": false
  },
  {
    "name": "whisperkittools",
    "description": "Python tools for WhisperKit: Model conversion, optimization and evaluation",
    "author": "KBLLR",
    "stars": 0,
    "url": "https://github.com/KBLLR/whisperkittools",
    "date": "2/12/2024",
    "languages": [],
    "topics": [],
    "primary_language": "Unknown",
    "license": "MIT",
    "forks": 0,
    "open_issues": 0,
    "last_updated": "1/30/2024",
    "last_updated_at": "2024-01-30T14:11:53Z",
    "created_at": "2024-02-12T16:45:14Z",
    "private": false,
    "has_readme": true,
    "is_owner": true,
    "is_fork": true
  },
  {
    "name": "tldraw-mlx",
    "description": "A starter for working with tldraw integrating MLX Apple Framework examples",
    "author": "KBLLR",
    "stars": 0,
    "url": "https://github.com/KBLLR/tldraw-mlx",
    "date": "12/12/2023",
    "languages": [
      {
        "language": "TypeScript",
        "percentage": "100%"
      }
    ],
    "topics": [],
    "primary_language": "TypeScript",
    "license": "GPL-3.0",
    "forks": 13,
    "open_issues": 0,
    "last_updated": "12/12/2023",
    "last_updated_at": "2023-12-12T13:55:38Z",
    "created_at": "2023-12-12T13:41:18Z",
    "private": false,
    "has_readme": true,
    "is_owner": true,
    "is_fork": false
  },
  {
    "name": "Hands-On-Image-Generation-with-TensorFlow-2.0",
    "description": "Hands-On Image Generation with TensorFlow 2.0",
    "author": "KBLLR",
    "stars": 0,
    "url": "https://github.com/KBLLR/Hands-On-Image-Generation-with-TensorFlow-2.0",
    "date": "12/8/2023",
    "languages": [],
    "topics": [],
    "primary_language": "Unknown",
    "license": "MIT",
    "forks": 0,
    "open_issues": 0,
    "last_updated": "3/24/2023",
    "last_updated_at": "2023-03-24T22:40:46Z",
    "created_at": "2023-12-08T13:00:08Z",
    "private": false,
    "has_readme": true,
    "is_owner": true,
    "is_fork": true
  },
  {
    "name": "the-generalist-ai",
    "description": "No description",
    "author": "KBLLR",
    "stars": 0,
    "url": "https://github.com/KBLLR/the-generalist-ai",
    "date": "10/14/2023",
    "languages": [
      {
        "language": "JavaScript",
        "percentage": "100%"
      }
    ],
    "topics": [],
    "primary_language": "JavaScript",
    "license": "None",
    "forks": 0,
    "open_issues": 0,
    "last_updated": "10/14/2023",
    "last_updated_at": "2023-10-14T10:32:11Z",
    "created_at": "2023-10-14T10:27:47Z",
    "private": true,
    "has_readme": true,
    "is_owner": true,
    "is_fork": false
  },
  {
    "name": "full-stack-documentation-site",
    "description": "Full-Stack Documentation Site",
    "author": "KBLLR",
    "stars": 0,
    "url": "https://github.com/KBLLR/full-stack-documentation-site",
    "date": "10/12/2023",
    "languages": [
      {
        "language": "CSS",
        "percentage": "100%"
      }
    ],
    "topics": [
      "documentation",
      "full-stack",
      "mongodb",
      "vercel",
      "vite"
    ],
    "primary_language": "CSS",
    "license": "MIT",
    "forks": 0,
    "open_issues": 0,
    "last_updated": "10/14/2023",
    "last_updated_at": "2023-10-14T07:25:18Z",
    "created_at": "2023-10-12T11:45:17Z",
    "private": true,
    "has_readme": true,
    "is_owner": true,
    "is_fork": false
  },
  {
    "name": "Do-Project",
    "description": "Reviving an old fun project for a gamified computer vision learning mini app",
    "author": "KBLLR",
    "stars": 0,
    "url": "https://github.com/KBLLR/Do-Project",
    "date": "10/11/2023",
    "languages": [],
    "topics": [],
    "primary_language": "Unknown",
    "license": "None",
    "forks": 0,
    "open_issues": 0,
    "last_updated": "10/11/2023",
    "last_updated_at": "2023-10-11T21:17:08Z",
    "created_at": "2023-10-11T21:17:07Z",
    "private": false,
    "has_readme": false,
    "is_owner": true,
    "is_fork": false
  },
  {
    "name": "cog-sdxl",
    "description": "Stable Diffusion XL training and inference as a cog model",
    "author": "KBLLR",
    "stars": 0,
    "url": "https://github.com/KBLLR/cog-sdxl",
    "date": "9/15/2023",
    "languages": [],
    "topics": [],
    "primary_language": "Unknown",
    "license": "None",
    "forks": 0,
    "open_issues": 0,
    "last_updated": "9/15/2023",
    "last_updated_at": "2023-09-15T14:34:18Z",
    "created_at": "2023-09-15T14:32:45Z",
    "private": false,
    "has_readme": true,
    "is_owner": true,
    "is_fork": true
  },
  {
    "name": "ccapture.js",
    "description": "A library to capture canvas-based animations at a fixed framerate",
    "author": "KBLLR",
    "stars": 0,
    "url": "https://github.com/KBLLR/ccapture.js",
    "date": "9/13/2023",
    "languages": [],
    "topics": [],
    "primary_language": "Unknown",
    "license": "MIT",
    "forks": 0,
    "open_issues": 0,
    "last_updated": "12/4/2022",
    "last_updated_at": "2022-12-04T17:17:23Z",
    "created_at": "2023-09-13T04:04:30Z",
    "private": false,
    "has_readme": true,
    "is_owner": true,
    "is_fork": true
  },
  {
    "name": "THREE.CubemapToEquirectangular",
    "description": "Export an equirectangular panorama image from a three.js scene",
    "author": "KBLLR",
    "stars": 0,
    "url": "https://github.com/KBLLR/THREE.CubemapToEquirectangular",
    "date": "9/13/2023",
    "languages": [],
    "topics": [],
    "primary_language": "Unknown",
    "license": "MIT",
    "forks": 0,
    "open_issues": 0,
    "last_updated": "4/15/2021",
    "last_updated_at": "2021-04-15T09:33:38Z",
    "created_at": "2023-09-13T04:01:34Z",
    "private": false,
    "has_readme": true,
    "is_owner": true,
    "is_fork": true
  },
  {
    "name": "HomeLab_flame",
    "description": "Flame is self-hosted startpage for your server. Easily manage your apps and bookmarks with built-in editors.",
    "author": "KBLLR",
    "stars": 0,
    "url": "https://github.com/KBLLR/HomeLab_flame",
    "date": "9/12/2023",
    "languages": [],
    "topics": [],
    "primary_language": "Unknown",
    "license": "MIT",
    "forks": 0,
    "open_issues": 0,
    "last_updated": "8/12/2023",
    "last_updated_at": "2023-08-12T13:29:12Z",
    "created_at": "2023-09-12T18:02:09Z",
    "private": false,
    "has_readme": true,
    "is_owner": true,
    "is_fork": true
  },
  {
    "name": "HomeLab",
    "description": "No description",
    "author": "KBLLR",
    "stars": 0,
    "url": "https://github.com/KBLLR/HomeLab",
    "date": "9/12/2023",
    "languages": [
      {
        "language": "Vue",
        "percentage": "100%"
      }
    ],
    "topics": [],
    "primary_language": "Vue",
    "license": "MIT",
    "forks": 0,
    "open_issues": 0,
    "last_updated": "9/12/2023",
    "last_updated_at": "2023-09-12T14:24:57Z",
    "created_at": "2023-09-12T14:24:18Z",
    "private": true,
    "has_readme": true,
    "is_owner": true,
    "is_fork": false
  },
  {
    "name": "infoq-mini-book",
    "description": "Template project for creating an InfoQ Mini-Book with Asciidoctor",
    "author": "KBLLR",
    "stars": 0,
    "url": "https://github.com/KBLLR/infoq-mini-book",
    "date": "9/9/2023",
    "languages": [],
    "topics": [],
    "primary_language": "Unknown",
    "license": "Apache-2.0",
    "forks": 0,
    "open_issues": 0,
    "last_updated": "9/7/2023",
    "last_updated_at": "2023-09-06T23:39:08Z",
    "created_at": "2023-09-09T10:56:27Z",
    "private": false,
    "has_readme": true,
    "is_owner": true,
    "is_fork": true
  },
  {
    "name": "roop",
    "description": "one-click deepfake (face swap)",
    "author": "KBLLR",
    "stars": 0,
    "url": "https://github.com/KBLLR/roop",
    "date": "8/17/2023",
    "languages": [],
    "topics": [],
    "primary_language": "Unknown",
    "license": "GPL-3.0",
    "forks": 0,
    "open_issues": 1,
    "last_updated": "8/17/2023",
    "last_updated_at": "2023-08-17T08:48:39Z",
    "created_at": "2023-08-17T08:41:15Z",
    "private": false,
    "has_readme": true,
    "is_owner": true,
    "is_fork": true
  },
  {
    "name": "kbllr_graphics_",
    "description": "No description",
    "author": "KBLLR",
    "stars": 0,
    "url": "https://github.com/KBLLR/kbllr_graphics_",
    "date": "7/7/2023",
    "languages": [],
    "topics": [],
    "primary_language": "Unknown",
    "license": "None",
    "forks": 0,
    "open_issues": 0,
    "last_updated": "7/7/2023",
    "last_updated_at": "2023-07-07T07:02:56Z",
    "created_at": "2023-07-07T07:02:55Z",
    "private": false,
    "has_readme": false,
    "is_owner": true,
    "is_fork": false
  },
  {
    "name": "Shap-e_Img-to-3D_google_collab",
    "description": "No description",
    "author": "KBLLR",
    "stars": 0,
    "url": "https://github.com/KBLLR/Shap-e_Img-to-3D_google_collab",
    "date": "5/13/2023",
    "languages": [
      {
        "language": "Jupyter Notebook",
        "percentage": "100%"
      }
    ],
    "topics": [],
    "primary_language": "Jupyter Notebook",
    "license": "MIT",
    "forks": 0,
    "open_issues": 0,
    "last_updated": "5/13/2023",
    "last_updated_at": "2023-05-13T19:43:02Z",
    "created_at": "2023-05-13T16:53:31Z",
    "private": false,
    "has_readme": true,
    "is_owner": true,
    "is_fork": false
  },
  {
    "name": "dsjlf3",
    "description": "No description",
    "author": "KBLLR",
    "stars": 0,
    "url": "https://github.com/KBLLR/dsjlf3",
    "date": "4/5/2023",
    "languages": [
      {
        "language": "JavaScript",
        "percentage": "100%"
      }
    ],
    "topics": [],
    "primary_language": "JavaScript",
    "license": "None",
    "forks": 0,
    "open_issues": 0,
    "last_updated": "4/5/2023",
    "last_updated_at": "2023-04-05T14:01:42Z",
    "created_at": "2023-04-05T13:32:11Z",
    "private": false,
    "has_readme": true,
    "is_owner": true,
    "is_fork": false
  },
  {
    "name": "OBLIK-3D-Furniture-Configurator",
    "description": "Developing a custom 3D furniture viewer and configurator for emblematic Design shop \"OBLIK\" (Berlin)",
    "author": "KBLLR",
    "stars": 0,
    "url": "https://github.com/KBLLR/OBLIK-3D-Furniture-Configurator",
    "date": "3/21/2023",
    "languages": [
      {
        "language": "JavaScript",
        "percentage": "100%"
      }
    ],
    "topics": [],
    "primary_language": "JavaScript",
    "license": "None",
    "forks": 0,
    "open_issues": 0,
    "last_updated": "4/21/2023",
    "last_updated_at": "2023-04-21T14:53:11Z",
    "created_at": "2023-03-21T18:04:21Z",
    "private": false,
    "has_readme": true,
    "is_owner": true,
    "is_fork": false
  },
  {
    "name": "glTF_3Dmodel-Configurator",
    "description": "No description",
    "author": "KBLLR",
    "stars": 0,
    "url": "https://github.com/KBLLR/glTF_3Dmodel-Configurator",
    "date": "3/12/2023",
    "languages": [
      {
        "language": "JavaScript",
        "percentage": "100%"
      }
    ],
    "topics": [],
    "primary_language": "JavaScript",
    "license": "None",
    "forks": 0,
    "open_issues": 0,
    "last_updated": "3/12/2023",
    "last_updated_at": "2023-03-12T09:59:20Z",
    "created_at": "2023-03-12T09:59:17Z",
    "private": true,
    "has_readme": true,
    "is_owner": true,
    "is_fork": false
  },
  {
    "name": "threejs-Vite-template-complex",
    "description": "No description",
    "author": "KBLLR",
    "stars": 0,
    "url": "https://github.com/KBLLR/threejs-Vite-template-complex",
    "date": "3/12/2023",
    "languages": [],
    "topics": [],
    "primary_language": "Unknown",
    "license": "None",
    "forks": 0,
    "open_issues": 0,
    "last_updated": "12/12/2022",
    "last_updated_at": "2022-12-12T20:30:52Z",
    "created_at": "2023-03-12T09:56:48Z",
    "private": false,
    "has_readme": true,
    "is_owner": true,
    "is_fork": true
  },
  {
    "name": "ThreeJS-Webpack-ES6-Boilerplate",
    "description": "A basic boilerplate for a Three.js project compiled with Webpack and transpiled via Babel to enable using ES6 syntax.",
    "author": "KBLLR",
    "stars": 0,
    "url": "https://github.com/KBLLR/ThreeJS-Webpack-ES6-Boilerplate",
    "date": "5/3/2022",
    "languages": [],
    "topics": [],
    "primary_language": "Unknown",
    "license": "MIT",
    "forks": 0,
    "open_issues": 0,
    "last_updated": "4/28/2022",
    "last_updated_at": "2022-04-28T03:16:41Z",
    "created_at": "2022-05-03T21:51:02Z",
    "private": false,
    "has_readme": true,
    "is_owner": true,
    "is_fork": true
  },
  {
    "name": "Three.js-TypeScript-Boilerplate",
    "description": "Three.js TypeScript Boilerplate",
    "author": "KBLLR",
    "stars": 0,
    "url": "https://github.com/KBLLR/Three.js-TypeScript-Boilerplate",
    "date": "6/17/2022",
    "languages": [],
    "topics": [],
    "primary_language": "Unknown",
    "license": "MIT",
    "forks": 0,
    "open_issues": 0,
    "last_updated": "5/25/2022",
    "last_updated_at": "2022-05-25T21:08:42Z",
    "created_at": "2022-06-17T00:42:54Z",
    "private": false,
    "has_readme": true,
    "is_owner": true,
    "is_fork": true
  },
  {
    "name": "threejs-template-simple",
    "description": "No description",
    "author": "KBLLR",
    "stars": 0,
    "url": "https://github.com/KBLLR/threejs-template-simple",
    "date": "3/12/2023",
    "languages": [],
    "topics": [],
    "primary_language": "Unknown",
    "license": "None",
    "forks": 0,
    "open_issues": 0,
    "last_updated": "9/2/2022",
    "last_updated_at": "2022-09-01T22:32:39Z",
    "created_at": "2023-03-12T06:35:59Z",
    "private": false,
    "has_readme": true,
    "is_owner": true,
    "is_fork": true
  },
  {
    "name": "gpt-3_chrome_extension",
    "description": "Use OpenAI's GPT-3 API prompter on any website. On this fork I intend to improve UI and extend functionality. ",
    "author": "KBLLR",
    "stars": 0,
    "url": "https://github.com/KBLLR/gpt-3_chrome_extension",
    "date": "1/9/2023",
    "languages": [],
    "topics": [],
    "primary_language": "Unknown",
    "license": "MIT",
    "forks": 0,
    "open_issues": 0,
    "last_updated": "11/29/2022",
    "last_updated_at": "2022-11-29T19:16:06Z",
    "created_at": "2023-01-09T22:26:56Z",
    "private": false,
    "has_readme": true,
    "is_owner": true,
    "is_fork": true
  },
  {
    "name": "ThreeBoilerplate",
    "description": "No description",
    "author": "KBLLR",
    "stars": 0,
    "url": "https://github.com/KBLLR/ThreeBoilerplate",
    "date": "10/4/2022",
    "languages": [
      {
        "language": "JavaScript",
        "percentage": "100%"
      }
    ],
    "topics": [],
    "primary_language": "JavaScript",
    "license": "None",
    "forks": 0,
    "open_issues": 0,
    "last_updated": "3/6/2023",
    "last_updated_at": "2023-03-06T10:39:35Z",
    "created_at": "2022-10-04T11:45:19Z",
    "private": false,
    "has_readme": true,
    "is_owner": true,
    "is_fork": true
  },
  {
    "name": "imgui-js",
    "description": "JavaScript bindings for Dear ImGui using Emscripten and TypeScript",
    "author": "KBLLR",
    "stars": 0,
    "url": "https://github.com/KBLLR/imgui-js",
    "date": "6/19/2022",
    "languages": [],
    "topics": [],
    "primary_language": "Unknown",
    "license": "MIT",
    "forks": 0,
    "open_issues": 0,
    "last_updated": "1/29/2022",
    "last_updated_at": "2022-01-29T13:55:46Z",
    "created_at": "2022-06-19T12:41:55Z",
    "private": false,
    "has_readme": true,
    "is_owner": true,
    "is_fork": true
  },
  {
    "name": "webgl-shader-examples",
    "description": "Some simple examples of WebGL shaders",
    "author": "KBLLR",
    "stars": 0,
    "url": "https://github.com/KBLLR/webgl-shader-examples",
    "date": "5/30/2022",
    "languages": [],
    "topics": [],
    "primary_language": "Unknown",
    "license": "LGPL-3.0",
    "forks": 0,
    "open_issues": 0,
    "last_updated": "2/22/2019",
    "last_updated_at": "2019-02-22T17:28:33Z",
    "created_at": "2022-05-29T22:58:54Z",
    "private": false,
    "has_readme": true,
    "is_owner": true,
    "is_fork": true
  },
  {
    "name": "Final-MariCoin",
    "description": "No description",
    "author": "KBLLR",
    "stars": 0,
    "url": "https://github.com/KBLLR/Final-MariCoin",
    "date": "1/10/2022",
    "languages": [
      {
        "language": "HTML",
        "percentage": "100%"
      }
    ],
    "topics": [],
    "primary_language": "HTML",
    "license": "MIT",
    "forks": 0,
    "open_issues": 0,
    "last_updated": "10/9/2025",
    "last_updated_at": "2025-10-09T14:25:50Z",
    "created_at": "2022-01-10T14:20:53Z",
    "private": true,
    "has_readme": true,
    "is_owner": true,
    "is_fork": false
  },
  {
    "name": "3DKNIGHT",
    "description": "David Caballero Designer and Creative Developer Portfolio [2020 - 2022] ",
    "author": "KBLLR",
    "stars": 0,
    "url": "https://github.com/KBLLR/3DKNIGHT",
    "date": "3/20/2022",
    "languages": [
      {
        "language": "CSS",
        "percentage": "100%"
      }
    ],
    "topics": [],
    "primary_language": "CSS",
    "license": "MIT",
    "forks": 0,
    "open_issues": 0,
    "last_updated": "5/29/2022",
    "last_updated_at": "2022-05-29T19:31:51Z",
    "created_at": "2022-03-20T19:21:30Z",
    "private": true,
    "has_readme": true,
    "is_owner": true,
    "is_fork": false
  },
  {
    "name": "testing-AlienJs",
    "description": "No description",
    "author": "KBLLR",
    "stars": 0,
    "url": "https://github.com/KBLLR/testing-AlienJs",
    "date": "4/9/2022",
    "languages": [
      {
        "language": "JavaScript",
        "percentage": "100%"
      }
    ],
    "topics": [],
    "primary_language": "JavaScript",
    "license": "MIT",
    "forks": 0,
    "open_issues": 0,
    "last_updated": "4/9/2022",
    "last_updated_at": "2022-04-09T15:42:47Z",
    "created_at": "2022-04-09T15:42:45Z",
    "private": false,
    "has_readme": true,
    "is_owner": true,
    "is_fork": false
  },
  {
    "name": "my-room-in-3d",
    "description": "No description",
    "author": "KBLLR",
    "stars": 0,
    "url": "https://github.com/KBLLR/my-room-in-3d",
    "date": "3/17/2022",
    "languages": [],
    "topics": [],
    "primary_language": "Unknown",
    "license": "None",
    "forks": 0,
    "open_issues": 0,
    "last_updated": "9/13/2021",
    "last_updated_at": "2021-09-13T11:44:39Z",
    "created_at": "2022-03-17T18:24:15Z",
    "private": false,
    "has_readme": true,
    "is_owner": true,
    "is_fork": true
  },
  {
    "name": "flowmap-effect",
    "description": "Mouse Flowmap Deformation with OGL",
    "author": "KBLLR",
    "stars": 0,
    "url": "https://github.com/KBLLR/flowmap-effect",
    "date": "5/30/2022",
    "languages": [],
    "topics": [],
    "primary_language": "Unknown",
    "license": "None",
    "forks": 0,
    "open_issues": 0,
    "last_updated": "9/26/2019",
    "last_updated_at": "2019-09-26T04:29:50Z",
    "created_at": "2022-05-29T22:37:53Z",
    "private": false,
    "has_readme": true,
    "is_owner": true,
    "is_fork": true
  },
  {
    "name": "MCOIN-Case",
    "description": "No description",
    "author": "KBLLR",
    "stars": 0,
    "url": "https://github.com/KBLLR/MCOIN-Case",
    "date": "1/17/2022",
    "languages": [
      {
        "language": "HTML",
        "percentage": "100%"
      }
    ],
    "topics": [],
    "primary_language": "HTML",
    "license": "None",
    "forks": 0,
    "open_issues": 0,
    "last_updated": "1/17/2022",
    "last_updated_at": "2022-01-17T07:12:23Z",
    "created_at": "2022-01-17T06:46:22Z",
    "private": true,
    "has_readme": true,
    "is_owner": true,
    "is_fork": false
  },
  {
    "name": "D-KNIGHT-NFT",
    "description": "No description",
    "author": "KBLLR",
    "stars": 1,
    "url": "https://github.com/KBLLR/D-KNIGHT-NFT",
    "date": "12/10/2021",
    "languages": [],
    "topics": [],
    "primary_language": "Unknown",
    "license": "None",
    "forks": 0,
    "open_issues": 0,
    "last_updated": "3/24/2022",
    "last_updated_at": "2022-03-24T05:12:13Z",
    "created_at": "2021-12-09T23:13:25Z",
    "private": false,
    "has_readme": true,
    "is_owner": true,
    "is_fork": false
  },
  {
    "name": "JSTouchController",
    "description": "A simple demo of multitouch dual analogue controls in JavaScript",
    "author": "KBLLR",
    "stars": 0,
    "url": "https://github.com/KBLLR/JSTouchController",
    "date": "5/5/2022",
    "languages": [],
    "topics": [],
    "primary_language": "Unknown",
    "license": "None",
    "forks": 0,
    "open_issues": 0,
    "last_updated": "6/13/2012",
    "last_updated_at": "2012-06-13T14:37:59Z",
    "created_at": "2022-05-04T22:02:32Z",
    "private": false,
    "has_readme": true,
    "is_owner": true,
    "is_fork": true
  },
  {
    "name": "macbook-keyboard",
    "description": "Mackbook keyboard using CSS",
    "author": "KBLLR",
    "stars": 0,
    "url": "https://github.com/KBLLR/macbook-keyboard",
    "date": "5/17/2021",
    "languages": [],
    "topics": [],
    "primary_language": "Unknown",
    "license": "None",
    "forks": 0,
    "open_issues": 0,
    "last_updated": "4/30/2021",
    "last_updated_at": "2021-04-30T15:06:31Z",
    "created_at": "2021-05-17T02:30:57Z",
    "private": false,
    "has_readme": true,
    "is_owner": true,
    "is_fork": true
  },
  {
    "name": "Sieve",
    "description": "Product page for app dedicated to social gatherings and meaningful relationships.",
    "author": "KBLLR",
    "stars": 0,
    "url": "https://github.com/KBLLR/Sieve",
    "date": "5/13/2021",
    "languages": [],
    "topics": [],
    "primary_language": "Unknown",
    "license": "MIT",
    "forks": 0,
    "open_issues": 0,
    "last_updated": "5/14/2021",
    "last_updated_at": "2021-05-14T18:48:39Z",
    "created_at": "2021-05-13T20:08:58Z",
    "private": false,
    "has_readme": true,
    "is_owner": true,
    "is_fork": false
  },
  {
    "name": "Resizable.js",
    "description": "A JavaScript library allowing the creation of manually resizable div elements.",
    "author": "KBLLR",
    "stars": 0,
    "url": "https://github.com/KBLLR/Resizable.js",
    "date": "5/14/2021",
    "languages": [],
    "topics": [],
    "primary_language": "Unknown",
    "license": "MIT",
    "forks": 0,
    "open_issues": 0,
    "last_updated": "5/8/2021",
    "last_updated_at": "2021-05-08T17:59:39Z",
    "created_at": "2021-05-14T05:44:04Z",
    "private": false,
    "has_readme": true,
    "is_owner": true,
    "is_fork": true
  },
  {
    "name": "Habi-eco",
    "description": "Product page for eco-conscious real state company from the Netherlands.",
    "author": "KBLLR",
    "stars": 0,
    "url": "https://github.com/KBLLR/Habi-eco",
    "date": "5/13/2021",
    "languages": [],
    "topics": [],
    "primary_language": "Unknown",
    "license": "MIT",
    "forks": 0,
    "open_issues": 0,
    "last_updated": "5/13/2021",
    "last_updated_at": "2021-05-13T20:01:53Z",
    "created_at": "2021-05-13T19:53:07Z",
    "private": false,
    "has_readme": true,
    "is_owner": true,
    "is_fork": false
  }
]